{
  "cwe_id": "CWE-565",
  "name": "Reliance on Cookies without Validation and Integrity Checking",
  "abstraction": "Base",
  "status": "Incomplete",
  "description": "The product relies on the existence or values of cookies when performing security-critical operations, but it does not properly ensure that the setting is valid for the associated user.",
  "extended_description": "",
  "relationships": {
    "parents": [
      {
        "cwe_id": "CWE-642",
        "nature": "ChildOf",
        "view_id": "1000",
        "ordinal": "Primary",
        "name": "External Control of Critical State Data"
      },
      {
        "cwe_id": "CWE-669",
        "nature": "ChildOf",
        "view_id": "1003",
        "ordinal": "Primary",
        "name": "Incorrect Resource Transfer Between Spheres"
      },
      {
        "cwe_id": "CWE-602",
        "nature": "ChildOf",
        "view_id": "1000",
        "ordinal": null,
        "name": "Client-Side Enforcement of Server-Side Security"
      }
    ],
    "children": [],
    "peers": []
  },
  "applicable_platforms": {
    "languages": [
      "Not Language-Specific"
    ],
    "technologies": [],
    "architectures": [],
    "paradigms": []
  },
  "introduction_phases": [
    "Architecture and Design",
    "Implementation"
  ],
  "likelihood_of_exploit": "Unknown",
  "mapping": {
    "usage": "Allowed",
    "fit": "",
    "rationale": "This CWE entry is at the Base level of abstraction, which is a preferred level of abstraction for mapping to the root causes of vulnerabilities."
  },
  "mechanism": {
    "root_cause_summary": "The product relies on the existence or values of cookies when performing security-critical operations, but it does not properly ensure that the setting is valid for the associated user.",
    "typical_preconditions": [
      "untrusted or insufficiently validated state reaches sensitive operation",
      "Architecture and Design",
      "Implementation"
    ],
    "typical_sources": [
      "untrusted or insufficiently validated state reaches sensitive operation"
    ],
    "typical_sinks": [
      "security-relevant operation"
    ],
    "typical_fix_actions": [
      "add explicit validation",
      "constrain state before sink",
      "fail closed on invalid condition"
    ],
    "negative_nonfix_signals": [
      "comment-only change",
      "rename-only change",
      "logging-only change",
      "style refactor without changing the sensitive path"
    ]
  },
  "code_signals": {
    "vuln_search_patterns": [
      "security-sensitive sink without sufficient guard",
      "cookies",
      "security-critical",
      "associated",
      "operations"
    ],
    "fix_search_patterns": [
      "explicit validation before sink",
      "reject invalid state",
      "safe helper/wrapper"
    ],
    "guard_patterns": [
      "same logical object and same sink context"
    ],
    "dangerous_generic_tokens": [
      "size",
      "len",
      "length",
      "count",
      "index",
      "idx",
      "buf",
      "data",
      "value",
      "ptr"
    ],
    "preferred_distinctive_tokens": [
      "cookies",
      "security-critical",
      "associated",
      "operations",
      "performing",
      "existence",
      "integrity",
      "checking"
    ]
  },
  "predicate_priors": {
    "preferred_scope": [
      "function",
      "anchor_window"
    ],
    "good_predicate_kinds": [
      "ordered_tokens",
      "proximity",
      "token_all"
    ],
    "discouraged_predicate_kinds": [
      "token_any"
    ],
    "recommended_guard_templates": [
      "same logical object and same sink context"
    ],
    "recommended_predicate_templates": [
      "security-sensitive sink without sufficient guard",
      "explicit validation before sink",
      "reject invalid state",
      "safe helper/wrapper"
    ]
  },
  "stage_hints": {
    "stage1": {
      "goal": "Classify patch chunks by how directly they repair the CWE root cause.",
      "must_focus": [
        "direct change to vulnerable sink or validation site",
        "changes that alter boundary, lifecycle, policy, or authorization relation",
        "supporting helper or error-propagation logic needed by the main fix"
      ],
      "must_avoid": [
        "comment-only or naming-only changes",
        "generic logging changes without security semantics",
        "refactors unrelated to the sensitive sink/path"
      ],
      "recommended_queries": [
        "security-sensitive sink without sufficient guard",
        "explicit validation before sink",
        "reject invalid state"
      ]
    },
    "stage2": {
      "goal": "Construct discriminative root cause, anchor, predicates, and guards.",
      "must_focus": [
        "anchor at the sink or dominant validation block",
        "prefer predicates that encode relations, not lone generic tokens",
        "choose function-local or anchor-window scope whenever possible"
      ],
      "must_avoid": [
        "whole-repo unscoped token matches",
        "predicates that rely on generic names alone",
        "anchors in wrappers that lack the core vulnerability mechanism"
      ],
      "recommended_queries": [
        "security-sensitive sink without sufficient guard",
        "same logical object and same sink context"
      ]
    },
    "stage3": {
      "goal": "Verify whether the target tag still exhibits the vulnerable relation or already contains the fix relation.",
      "must_focus": [
        "whether the sensitive sink/path still exists",
        "whether the fix relation is locally present in the same code region",
        "whether anchor relocation is required before concluding absence"
      ],
      "must_avoid": [
        "declaring NOT_AFFECTED from generic token absence alone",
        "assuming refactor/rename means vulnerability removal",
        "using broad token matches as final evidence"
      ],
      "recommended_queries": [
        "explicit validation before sink",
        "reject invalid state",
        "security-sensitive sink without sufficient guard"
      ]
    }
  },
  "examples": {
    "bad_examples": [
      {
        "language": "Java",
        "nature": "Bad",
        "summary": "The following code excerpt reads a value from a browser cookie to determine the role of the user.",
        "snippet": "Cookie[] cookies = request.getCookies(); for (int i =0; i< cookies.length; i++) { Cookie c = cookies[i]; if (c.getName().equals(\"role\")) { userRole = c.getValue(); } }"
      }
    ],
    "good_examples": [],
    "observed_examples": [
      {
        "reference": "CVE-2008-5784",
        "description": "e-dating application allows admin privileges by setting the admin cookie to 1.",
        "link": "https://www.cve.org/CVERecord?id=CVE-2008-5784"
      }
    ]
  },
  "repo_notes": {},
  "evolution": {
    "usage_count": 0,
    "success_count": 0,
    "fp_lessons": [],
    "fn_lessons": [],
    "last_updated": null
  },
  "metadata": {
    "source_xml": "CWE-2000.xml",
    "catalog_version": "4.19.1",
    "generated_at": "2026-04-15T14:30:34.543593+00:00"
  }
}