{
  "cwe_id": "CWE-263",
  "name": "Password Aging with Long Expiration",
  "abstraction": "Base",
  "status": "Draft",
  "description": "The product supports password aging, but the expiration period is too long.",
  "extended_description": "Password aging (or password rotation) is a policy that forces users to change their passwords after a defined time period passes, such as every 30 or 90 days. A long expiration provides more time for attackers to conduct password cracking before users are forced to change to a new password. Note that while password aging was once considered an important security feature, it has since fallen out of favor by many, because it is not as effective against modern threats compared to other mechanisms such as slow hashes. In addition, forcing frequent changes can unintentionally encourage users to select less-secure passwords. However, password aging is still in use due to factors such as compliance requirements, e.g., Payment Card Industry Data Security Standard (PCI DSS).",
  "relationships": {
    "parents": [
      {
        "cwe_id": "CWE-1390",
        "nature": "ChildOf",
        "view_id": "1000",
        "ordinal": "Primary",
        "name": "Weak Authentication"
      }
    ],
    "children": [],
    "peers": []
  },
  "applicable_platforms": {
    "languages": [
      "Not Language-Specific"
    ],
    "technologies": [],
    "architectures": [],
    "paradigms": []
  },
  "introduction_phases": [
    "Architecture and Design"
  ],
  "likelihood_of_exploit": "Low",
  "mapping": {
    "usage": "Discouraged",
    "fit": "",
    "rationale": "This CWE entry is closely related to the absence of a practice (password expiration) that is no longer widely supported as an effective protection mechanism. In addition, it might be deprecated in the future."
  },
  "mechanism": {
    "root_cause_summary": "The product supports password aging, but the expiration period is too long.",
    "typical_preconditions": [
      "untrusted or insufficiently validated state reaches sensitive operation",
      "Architecture and Design"
    ],
    "typical_sources": [
      "untrusted or insufficiently validated state reaches sensitive operation"
    ],
    "typical_sinks": [
      "security-relevant operation"
    ],
    "typical_fix_actions": [
      "add explicit validation",
      "constrain state before sink",
      "fail closed on invalid condition"
    ],
    "negative_nonfix_signals": [
      "comment-only change",
      "rename-only change",
      "logging-only change",
      "style refactor without changing the sensitive path"
    ]
  },
  "code_signals": {
    "vuln_search_patterns": [
      "security-sensitive sink without sufficient guard",
      "password",
      "aging",
      "expiration",
      "users"
    ],
    "fix_search_patterns": [
      "explicit validation before sink",
      "reject invalid state",
      "safe helper/wrapper"
    ],
    "guard_patterns": [
      "same logical object and same sink context"
    ],
    "dangerous_generic_tokens": [
      "size",
      "len",
      "length",
      "count",
      "index",
      "idx",
      "buf",
      "data",
      "value",
      "ptr"
    ],
    "preferred_distinctive_tokens": [
      "password",
      "aging",
      "expiration",
      "users",
      "long",
      "passwords",
      "change",
      "period"
    ]
  },
  "predicate_priors": {
    "preferred_scope": [
      "function",
      "anchor_window"
    ],
    "good_predicate_kinds": [
      "ordered_tokens",
      "proximity",
      "token_all"
    ],
    "discouraged_predicate_kinds": [
      "token_any"
    ],
    "recommended_guard_templates": [
      "same logical object and same sink context"
    ],
    "recommended_predicate_templates": [
      "security-sensitive sink without sufficient guard",
      "explicit validation before sink",
      "reject invalid state",
      "safe helper/wrapper"
    ]
  },
  "stage_hints": {
    "stage1": {
      "goal": "Classify patch chunks by how directly they repair the CWE root cause.",
      "must_focus": [
        "direct change to vulnerable sink or validation site",
        "changes that alter boundary, lifecycle, policy, or authorization relation",
        "supporting helper or error-propagation logic needed by the main fix"
      ],
      "must_avoid": [
        "comment-only or naming-only changes",
        "generic logging changes without security semantics",
        "refactors unrelated to the sensitive sink/path"
      ],
      "recommended_queries": [
        "security-sensitive sink without sufficient guard",
        "explicit validation before sink",
        "reject invalid state"
      ]
    },
    "stage2": {
      "goal": "Construct discriminative root cause, anchor, predicates, and guards.",
      "must_focus": [
        "anchor at the sink or dominant validation block",
        "prefer predicates that encode relations, not lone generic tokens",
        "choose function-local or anchor-window scope whenever possible"
      ],
      "must_avoid": [
        "whole-repo unscoped token matches",
        "predicates that rely on generic names alone",
        "anchors in wrappers that lack the core vulnerability mechanism"
      ],
      "recommended_queries": [
        "security-sensitive sink without sufficient guard",
        "same logical object and same sink context"
      ]
    },
    "stage3": {
      "goal": "Verify whether the target tag still exhibits the vulnerable relation or already contains the fix relation.",
      "must_focus": [
        "whether the sensitive sink/path still exists",
        "whether the fix relation is locally present in the same code region",
        "whether anchor relocation is required before concluding absence"
      ],
      "must_avoid": [
        "declaring NOT_AFFECTED from generic token absence alone",
        "assuming refactor/rename means vulnerability removal",
        "using broad token matches as final evidence"
      ],
      "recommended_queries": [
        "explicit validation before sink",
        "reject invalid state",
        "security-sensitive sink without sufficient guard"
      ]
    }
  },
  "examples": {
    "bad_examples": [],
    "good_examples": [],
    "observed_examples": []
  },
  "repo_notes": {},
  "evolution": {
    "usage_count": 0,
    "success_count": 0,
    "fp_lessons": [],
    "fn_lessons": [],
    "last_updated": null
  },
  "metadata": {
    "source_xml": "CWE-2000.xml",
    "catalog_version": "4.19.1",
    "generated_at": "2026-04-15T14:30:34.543593+00:00"
  }
}