{
  "cwe_id": "CWE-403",
  "name": "Exposure of File Descriptor to Unintended Control Sphere ('File Descriptor Leak')",
  "abstraction": "Base",
  "status": "Draft",
  "description": "A process does not close sensitive file descriptors before invoking a child process, which allows the child to perform unauthorized I/O operations using those descriptors.",
  "extended_description": "When a new process is forked or executed, the child process inherits any open file descriptors. When the child process has fewer privileges than the parent process, this might introduce a vulnerability if the child process can access the file descriptor but does not have the privileges to access the associated file.",
  "relationships": {
    "parents": [
      {
        "cwe_id": "CWE-402",
        "nature": "ChildOf",
        "view_id": "1000",
        "ordinal": "Primary",
        "name": "Transmission of Private Resources into a New Sphere ('Resource Leak')"
      }
    ],
    "children": [],
    "peers": []
  },
  "applicable_platforms": {
    "languages": [
      "C",
      "Not Language-Specific"
    ],
    "technologies": [],
    "architectures": [],
    "paradigms": []
  },
  "introduction_phases": [
    "Implementation"
  ],
  "likelihood_of_exploit": "Unknown",
  "mapping": {
    "usage": "Allowed",
    "fit": "",
    "rationale": "This CWE entry is at the Base level of abstraction, which is a preferred level of abstraction for mapping to the root causes of vulnerabilities."
  },
  "mechanism": {
    "root_cause_summary": "A process does not close sensitive file descriptors before invoking a child process, which allows the child to perform unauthorized I/O operations using those descriptors.",
    "typical_preconditions": [
      "untrusted or insufficiently validated state reaches sensitive operation",
      "Implementation"
    ],
    "typical_sources": [
      "untrusted or insufficiently validated state reaches sensitive operation"
    ],
    "typical_sinks": [
      "security-relevant operation"
    ],
    "typical_fix_actions": [
      "add explicit validation",
      "constrain state before sink",
      "fail closed on invalid condition"
    ],
    "negative_nonfix_signals": [
      "comment-only change",
      "rename-only change",
      "logging-only change",
      "style refactor without changing the sensitive path"
    ]
  },
  "code_signals": {
    "vuln_search_patterns": [
      "security-sensitive sink without sufficient guard",
      "process",
      "file",
      "child",
      "descriptors"
    ],
    "fix_search_patterns": [
      "explicit validation before sink",
      "reject invalid state",
      "safe helper/wrapper"
    ],
    "guard_patterns": [
      "same logical object and same sink context"
    ],
    "dangerous_generic_tokens": [
      "size",
      "len",
      "length",
      "count",
      "index",
      "idx",
      "buf",
      "data",
      "value",
      "ptr"
    ],
    "preferred_distinctive_tokens": [
      "process",
      "file",
      "child",
      "descriptors",
      "descriptor",
      "privileges",
      "vulnerability",
      "unauthorized"
    ]
  },
  "predicate_priors": {
    "preferred_scope": [
      "function",
      "anchor_window"
    ],
    "good_predicate_kinds": [
      "ordered_tokens",
      "proximity",
      "token_all"
    ],
    "discouraged_predicate_kinds": [
      "token_any"
    ],
    "recommended_guard_templates": [
      "same logical object and same sink context"
    ],
    "recommended_predicate_templates": [
      "security-sensitive sink without sufficient guard",
      "explicit validation before sink",
      "reject invalid state",
      "safe helper/wrapper"
    ]
  },
  "stage_hints": {
    "stage1": {
      "goal": "Classify patch chunks by how directly they repair the CWE root cause.",
      "must_focus": [
        "direct change to vulnerable sink or validation site",
        "changes that alter boundary, lifecycle, policy, or authorization relation",
        "supporting helper or error-propagation logic needed by the main fix"
      ],
      "must_avoid": [
        "comment-only or naming-only changes",
        "generic logging changes without security semantics",
        "refactors unrelated to the sensitive sink/path"
      ],
      "recommended_queries": [
        "security-sensitive sink without sufficient guard",
        "explicit validation before sink",
        "reject invalid state"
      ]
    },
    "stage2": {
      "goal": "Construct discriminative root cause, anchor, predicates, and guards.",
      "must_focus": [
        "anchor at the sink or dominant validation block",
        "prefer predicates that encode relations, not lone generic tokens",
        "choose function-local or anchor-window scope whenever possible"
      ],
      "must_avoid": [
        "whole-repo unscoped token matches",
        "predicates that rely on generic names alone",
        "anchors in wrappers that lack the core vulnerability mechanism"
      ],
      "recommended_queries": [
        "security-sensitive sink without sufficient guard",
        "same logical object and same sink context"
      ]
    },
    "stage3": {
      "goal": "Verify whether the target tag still exhibits the vulnerable relation or already contains the fix relation.",
      "must_focus": [
        "whether the sensitive sink/path still exists",
        "whether the fix relation is locally present in the same code region",
        "whether anchor relocation is required before concluding absence"
      ],
      "must_avoid": [
        "declaring NOT_AFFECTED from generic token absence alone",
        "assuming refactor/rename means vulnerability removal",
        "using broad token matches as final evidence"
      ],
      "recommended_queries": [
        "explicit validation before sink",
        "reject invalid state",
        "security-sensitive sink without sufficient guard"
      ]
    }
  },
  "examples": {
    "bad_examples": [],
    "good_examples": [],
    "observed_examples": [
      {
        "reference": "CVE-2003-0740",
        "description": "Server leaks a privileged file descriptor, allowing the server to be hijacked.",
        "link": "https://www.cve.org/CVERecord?id=CVE-2003-0740"
      },
      {
        "reference": "CVE-2004-1033",
        "description": "File descriptor leak allows read of restricted files.",
        "link": "https://www.cve.org/CVERecord?id=CVE-2004-1033"
      },
      {
        "reference": "CVE-2000-0094",
        "description": "Access to restricted resource using modified file descriptor for stderr.",
        "link": "https://www.cve.org/CVERecord?id=CVE-2000-0094"
      },
      {
        "reference": "CVE-2002-0638",
        "description": "Open file descriptor used as alternate channel in complex race condition.",
        "link": "https://www.cve.org/CVERecord?id=CVE-2002-0638"
      },
      {
        "reference": "CVE-2003-0489",
        "description": "Program does not fully drop privileges after creating a file descriptor, which allows access to the descriptor via a separate vulnerability.",
        "link": "https://www.cve.org/CVERecord?id=CVE-2003-0489"
      },
      {
        "reference": "CVE-2003-0937",
        "description": "User bypasses restrictions by obtaining a file descriptor then calling setuid program, which does not close the descriptor.",
        "link": "https://www.cve.org/CVERecord?id=CVE-2003-0937"
      }
    ]
  },
  "repo_notes": {},
  "evolution": {
    "usage_count": 0,
    "success_count": 0,
    "fp_lessons": [],
    "fn_lessons": [],
    "last_updated": null
  },
  "metadata": {
    "source_xml": "CWE-2000.xml",
    "catalog_version": "4.19.1",
    "generated_at": "2026-04-15T14:30:34.543593+00:00"
  }
}